title,heading,content,tokens
Swimming at the 2016 Summer Olympics – Men's marathon 10 kilometre,Summary,"A photo finish saw Spyridon Gianniotis of Greece narrowly loses to dutchman Ferry Weertman for the gold, with both record time of 1:52:59.8 and 1:53:00.5. In the final race of his career, Gianniotis, who was also the oldest competitor at the age of 36, won the first medal for Greece in swimming since the inaugural 1896 Summer Olympics in Athens.
The battle for bronze also saw a photo finish, with France's Marc-Antoine Olivier pipping Zu Lijun and Jack Burnell on the line to finish in 1:53:02.0. Burnell was subsequently disqualified for a second yellow card for a tussle with defending champion Oussama Mellouli just before the line.",166
Cameroon at the 2016 Summer Olympics,Summary,"Cameroon competed at the 2016 Summer Olympics in Rio de Janeiro, Brazil, from 5 to 21 August 2016. It was the nation's fourteenth consecutive appearance at the Summer Olympics.
Cameroon Olympic Sports Committee (French: Comité National Olympique et Sportif du Cameroun) sent a total of 24 athletes, 5 men and 19 women, to the Games, competing in six different sports. For the second straight time in history, Cameroon was represented by more female than male athletes due to its presence of the women's volleyball team.
Notable athletes in the Cameroon team were professional boxers Mahaman Smaila and Hassan N'Dam N'Jikam, who both staged their Olympic comebacks in Rio de Janeiro for nearly a decade, and wrestler Annabelle Ali, who joined triple jumper and double gold medalist Françoise Mbango-Etone as the only Cameroonians to appear in three consecutive editions of the Games. Middleweight boxer Wilfried Ntsengue, the youngest member of the team (aged 18), was the nation's flag bearer in the opening ceremony.
Cameroon left Rio de Janeiro without a single Olympic medal. Ali narrowly missed out of Cameroon's first medal of the Games, after losing the match to Russia's Ekaterina Bukina for the bronze in the women's 75 kg category.",275
Cameroon at the 2016 Summer Olympics,Athletics (track and field),"Cameroonian athletes achieved qualifying standards in the following athletics events (up to a maximum of 3 athletes in each event):

Key
Note – Ranks given for track events are within the athlete's heat only
Q = Qualified for the next round
q = Qualified for the next round as a fastest loser or, in field events, by position without achieving the qualifying target
NR = National record
N/A = Round not applicable for the event
Bye = Athlete not required to compete in round
Field events",116
2016 African & Oceania Wrestling Olympic Qualification Tournament,Summary,"The 2016 Olympic Wrestling African & Oceania Qualification Tournament was the third regional qualifying tournament for the 2016 Olympics.
The top two wrestlers in each weight class earn a qualification spot for their nation.",44
Judo at the 2016 Summer Olympics – Men's 81 kg,Summary,"The men's 81 kg competition in judo at the 2016 Summer Olympics in Rio de Janeiro was held on 9 August at the Carioca Arena 2.
The gold and silver medals were determined by a single-elimination tournament, with the winner of the final taking gold and the loser receiving silver.  Judo events awarded two bronze medals.  Quarterfinal losers competed in a repechage match for the right to face a semifinal loser for a bronze medal (that is, the judokas defeated in quarterfinals A and B competed against each other, with the winner of that match facing the semifinal loser from the other half of the bracket).
The medals were presented by Henri, Grand Duke of Luxembourg, IOC member, and the gifts were presented by Mr. Naser Al Tamimi, General Treasurer of the International Judo Federation.",177
Cycling at the 2016 Summer Olympics – Men's omnium,Summary,"The men's cycling omnium at the 2016 Olympic Games in Rio de Janeiro took place at the Rio Olympic Velodrome on 14 and 15 August.
The medals were presented by Marisol Casado, IOC member, Spain and Renato Di Rocco, Member of the UCI Management Committee.",64
Cycling at the 2016 Summer Olympics – Men's omnium,Competition format,"The omnium competition consists of six events. During the first five events, riders receive points depending on their place, while during the final points race they can obtain points by winning sprints and taking laps during the event.

Scratch race: a 15 km (9.3 mi) scratch race, with all riders competing at once and first across the line winning.
Individual pursuit: a 4 km (2.5 mi) individual pursuit, with placing based on time.
Elimination race: a ""miss-and-out"" elimination race, with the last rider in every sprint (each two laps) eliminated.
Time trial: a 1 km (0.6 mi) time trial, with two riders (starting opposite the track) riding at once.
Flying lap: an individual time trial over 250 m (820.2 ft) with a ""flying start"".
Points race: a 40 km (24.9 mi) points race, with scoring for intermediate sprints as well as for lapping the pack.",214
Honduras at the 2016 Summer Olympics,Summary,"Honduras competed at the 2016 Summer Olympics in Rio de Janeiro, Brazil, from 5 to 21 August 2016. This was the nation's eleventh appearance at the Summer Olympics.
Honduran Olympic Committee (Spanish: Comité Olímpico Hondureño) sent the nation's second-largest delegation to the Games, matching its roster size with Beijing 2008. A total of 26 athletes, 25 men and 1 woman, were selected to the Honduran team across eight sports, with the men's football squad returning for its third consecutive appearance at these Games. Among the Honduran athletes were weightlifter Cristopher Pavón, butterfly swimmer Allan Gutiérrez, taekwondo fighter Miguel Ferrera, and track sprinter Rolando Palacios, who led the squad as the nation's flag bearer in the opening ceremony.
Honduras narrowly missed out on its first ever Olympic medal in Rio de Janeiro, as the men's football team, led by captain Bryan Acosta, suffered a 2–3 defeat to the Nigerians for the bronze.",221
Gymnastics at the 2016 Summer Olympics – Women's artistic individual all-around,Summary,"The women's artistic individual all-around competition at the 2016 Summer Olympics in Rio de Janeiro was held at the Arena Olímpica do Rio on 11 August.
Simone Biles and Aly Raisman of the United States finished first and second in qualifications and then won the gold and silver medals in the event final. It was the fourth consecutive Olympic gold for the U.S. in this event. Defending Olympic individual all-around champion from 2012 and another American, Gabby Douglas, qualified as third place behind her teammates, but due to the strict ""2 per country"" policy in event finals, she was barred from entering. Biles had won the individual all-around at the last three World Artistic Gymnastics Championships in 2013, 2014, and 2015. Aliya Mustafina of Russia won her second consecutive Olympic individual all-around bronze.",179
Gymnastics at the 2016 Summer Olympics – Women's artistic individual all-around,Competition format,"The top 24 qualifiers in the qualification phase (limit two per NOC), based on the combined score of each apparatus, advanced to the individual all-around final. The finalists performed on each apparatus again. Qualification scores were then ignored, with only final round scores counting.",58
Djibouti at the 2016 Summer Olympics,Summary,"Djibouti competed at the 2016 Summer Olympics in Rio de Janeiro, Brazil, from 5 to 21 August 2016. The nation's participation marked its eighth appearance at the Summer Olympics. Djibouti did not field any athletes at the 2004 Summer Olympics in Athens.
The Djibouti National Olympic Committee (French: Comité National Olympique Djiboutien) sent its second largest delegation to the Games, falling one athlete short of the record eight athletes sent to compete at the Barcelona 1992 Summer Olympic Games. A total of seven athletes, six men and one woman, were selected to the Djibouti team to compete in athletics, judo, and swimming. Marathoner Mumin Gala was the only athlete returning for his second appearance from London 2012, while middle-distance runner Abdi Waiss Mouhyadin led his squad as Djibouti's flag bearer in the opening ceremony.
Djibouti failed to collect an Olympic medal in Rio de Janeiro, which would have been the country's first since the 1988 Summer Olympics in Seoul, where Hussein Ahmed Salah won the bronze in the men's marathon. Ayanleh Souleiman almost ended the nation's 28-year drought on the podium, but he slipped out of medals to fourth in the men's 1500 metres.",271
Djibouti at the 2016 Summer Olympics,Background,"Djibouti participated in eight Summer Olympic Games between its debut in the 1984 Summer Olympics in Los Angeles, United States and the 2016 Summer Olympics in Rio de Janeiro. Djibouti made their Olympic debut in 1984, sending three athletes to the Games. The highest number of Djiboutian athletes participating in a Summer Games is eight in the 1992 Games in Barcelona, Spain. Marathon runner Hussein Ahmed Salah is the only Djiboutian athlete to win a medal, which he did in the 1988 marathon.",108
Sailing at the 2016 Summer Olympics – Laser,Summary,The men's Laser competition at the 2016 Summer Olympics in Rio de Janeiro took place between 8–16 August at Marina da Glória. Eleven races (the last one a medal race) were held.,45
Saint Vincent and the Grenadines at the 2016 Summer Olympics,Summary,"Saint Vincent and the Grenadines competed at the 2016 Summer Olympics in Rio de Janeiro, Brazil, from 5 to 21 August 2016. This was the nation's eighth consecutive appearance at the Summer Olympics.
The St. Vincent and the Grenadines National Olympic Committee sent the nation's largest delegation to the Games since 2000. Four athletes, two per gender, were selected to the roster, competing only in both swimming and track and field. All of them made their Olympic debut in Rio de Janeiro, except for sprinter Kineke Alexander, who spearheaded the delegation at her third straight Games as the oldest and most experienced competitor (aged 30) and the nation's flag bearer in the opening ceremony.",144
Saint Vincent and the Grenadines at the 2016 Summer Olympics,Athletics (track and field),"Athletes from Saint Vincent and the Grenadines have so far achieved qualifying standards in the following athletics events (up to a maximum of 3 athletes in each event):

Track & road events",46
The Gambia at the 2016 Summer Olympics,Summary,"The Gambia, officially the Republic of the Gambia, competed at the 2016 Summer Olympics in Rio de Janeiro, which was held from 5 to 21 August 2016. The country's participation at Rio marked its ninth appearance at the Summer Olympic Games since its début at the 1984 Summer Olympics. The delegation included two track and field athletes, Adama Jammeh and Gina Bass, who both qualified after meeting the qualification standards for their respective events, one judoka, Faye Njie, who made the Games through a quota place and one swimmer, Pap Jonga, who earned a universality place to enter the Games. The Gambia made their début appearances in the judo and swimming events. Bass was selected as the flag bearer for the opening and closing ceremonies. All four athletes were eliminated from the first rounds of their events.",174
The Gambia at the 2016 Summer Olympics,Background,"The Gambia participated in nine Summer Olympic Games between its début at the 1984 Summer Olympics in Los Angeles, United States and the 2016 Summer Olympics in Rio de Janeiro, Brazil. No Gambian athlete has ever won a medal at the Olympics and the country has not debuted at the Winter Olympic Games. The Gambia participated in the Rio Olympic Games from 5 to 21 August 2016. The four athletes that were chosen to compete in the Rio Games were athletes Adama Jammeh and Gina Bass, judoka Faye Njie and swimmer Pap Jonga. Three of the team's competitors trained at the Centro di Preparazione Olimpica di Formia after The Gambia's NOC secured funding for overseas training. Along with the four athletes, the country's delegation consisted of the NOC development officer and team leader Alhagie Dodou Capi Joo, athletics coach Mariama Sallah Saine, and swimming coach Arfang Y. Jobe. Bass was selected as the flag bearer for both the opening and closing ceremonies.",217
Cayman Islands at the 2016 Summer Olympics,Summary,"Cayman Islands competed at the 2016 Summer Olympics in Rio de Janeiro, Brazil, from 5 to 21 August 2016. This was the nation's tenth appearance at the Summer Olympics.
Cayman Islands Olympic Committee selected a total of five athletes, three men and two women, for the Games across three different sports (athletics, sailing, and swimming), matching its roster size from London 2012. Among the sports represented by the athletes, Cayman Islands marked its Olympic return in sailing after a sixteen-year absence.
The Caymanian team featured swimming siblings Geoffrey and Lara Butler, Laser Radial sailor Florence Allan, track sprinter Kemar Hyman, and hurdler Ronald Forbes, who joined Kareem Streete-Thompson as the only athletes to compete in three editions of the Games. The most experienced member of the team, Forbes was chosen by the committee to lead the delegation for the second time as Cayman Islands' flag bearer in the opening ceremony. Cayman Islands, however, has yet to win its first Olympic medal.",214
Somalia at the 2016 Summer Olympics,Summary,"Somalia competed at the 2016 Summer Olympics in Rio de Janeiro, Brazil, from 5 to 21 August 2016. The country's participation at Rio de Janeiro marked its ninth in the Summer Olympics since its debut in 1972. The delegation included two track and field athletes: sprinter Maryan Nuh Muse and long-distance runner Mohamed Daud Mohamed, who was the nation's flag bearer in the Parade of Nations. Neither athlete progressed past the first round of their respective competitions.",99
Somalia at the 2016 Summer Olympics,Background,"Somalia participated in nine Summer Olympics between its debut in the 1972 Summer Olympics in Munich, West Germany, and the 2016 Summer Olympics in Rio de Janeiro, Brazil. The highest number of Somalis participating at any single Summer Games was seven at the 1984 Games in Los Angeles, United States. No Somali has ever won a medal at an Olympics. Somalia received universality slots from the International Association of Athletics Federations to send one male and one female athlete to the 2016 Summer Olympics.
In 2014, the Somali Olympic Committee appointed a team of professionals to find talented Somali athletes for the upcoming Summer Olympics. Efforts were hampered by the ongoing Somali Civil War, both in access for the scouts and because athletes were fleeing the fighting. Samia Yusuf Omar, who represented the national at the 2008 Summer Olympics in Beijing, China, drowned off the Libyan coast while attempting to reach Europe by boat in 2012.
Maryan Nuh Muse was chosen to compete in the women's 400 metres and Kenyan-born Mohamed Daud Mohamed in the men's 5000 metres. Other Somali nationals competed at the 2016 Summer Olympics, but under the citizenships of other countries; these included Mo Farah, for Great Britain and Mohammed Ahmed, for Canada. Mohamed was chosen to be the Somalia's flag bearer during the Parade of Nations.",266
Nepal at the 2016 Summer Olympics,Summary,"Nepal competed at the 2016 Summer Olympics in Rio de Janeiro, Brazil, from 5 to 21 August 2016. This was the nation's thirteenth consecutive appearance at the Summer Olympics, although it failed to register any athletes in 1968.
The Nepal Olympic Committee selected a team of seven athletes, three men and four women, across five different sports at the Games; all of them made their Olympic debut in Rio de Janeiro through wild card entries and universality places, without having qualified. Among the nation's athletes were taekwondo fighter Nisha Rawal (women's +67 kg), London-based backstroke swimmer Gaurika Singh, who etched her name into the history records by becoming the youngest Olympian of the Games (aged 13), and judoka Phupu Lhamu Khatri, who also created history as the first female athlete to carry the Nepalese flag in the opening ceremony.
Nepal, however, has yet to win its first-ever Olympic medal. Unable to reach the final, Rawal bounced back from her early elimination in the opening match to produce a seventh-place feat as the best result for the Nepalis at the Games, losing the repechage bout to former world champion and 2008 bronze medalist Gwladys Épangue of France.",271
Benin at the 2016 Summer Olympics,Summary,"Benin competed at the 2016 Summer Olympics in Rio de Janeiro, Brazil, from 5 to 21 August 2016. This was the nation's eleventh appearance at the Summer Olympics, with the exception of the 1976 Summer Olympics in Montreal because of the African boycott.
Benin National Olympic and Sports Committee selected a team of six athletes, four men and two women, for the Games, competing in athletics, fencing, judo, and swimming. All of them made their maiden Olympic appearance, with sabre fencer Yémi Apithy leading the Benin team as the nation's flag bearer in the opening ceremony. Benin, however, has yet to win its first Olympic medal.",142
Sailing at the 2016 Summer Olympics – Nacra 17,Summary,The mixed Nacra 17 competition at the 2016 Summer Olympics in Rio de Janeiro took place between 10–16 August at Marina da Glória. Thirteen races (the last one a medal race) were held.,48
Triathlon at the 2016 Summer Olympics – Women's,Summary,"The women's triathlon at the 2016 Summer Olympics took place at Fort Copacabana in Rio de Janeiro on 20 August.
A total of 55 women from 31 nations competed in the race.
The medals were presented by Marisol Casado, IOC member, Spain and Antonio Álvarez, Vice President of the International Triathlon Union.",75
Niger at the 2016 Summer Olympics,Summary,"Niger competed at the 2016 Summer Olympics in Rio de Janeiro, Brazil, from 5 to 21 August 2016. Since the nation made its debut in 1964, Nigerien athletes had participated in every edition of the Summer Olympic Games, except for two rare occasions, the 1976 Summer Olympics in Montreal, and the 1980 Summer Olympics in Moscow because of the African and the US-led boycotts, respectively.
Nigerien Olympic and National Sports Committee (French: Comité Olympique et Sportif National du Niger, COSNI) sent a team of six athletes, four men and two women, to compete in four different sports at the Olympics, matching the nation's roster size with London 2012. This was also the youngest delegation in Niger's Olympic history, with about half the team under the age of 25, and many of the team members were expected to reach their peak in time for the 2020 Summer Olympics in Tokyo. All of the Nigerien athletes made their Olympic debut in Rio de Janeiro, with six-foot-nine taekwondo fighter Abdoul Razak Issoufou leading the team as the nation's flag bearer in the opening ceremony.
Niger left Rio de Janeiro with its first ever Olympic medal of any color since the 1972 Summer Olympics in Munich. It was awarded to Issoufou in the men's heavyweight category (+80 kg).",276
Equestrian at the 2016 Summer Olympics – Individual jumping,Summary,"The individual show jumping in equestrian at the Rio 2016 Summer Olympics was held from 14–19 August. Like all other equestrian events, the jumping competition was mixed gender, with both male and female athletes competing in the same division. There were 74 competitors from 27 nations. The event was won by Nick Skelton of Great Britain, the nation's first victory in individual jumping and first medal of any color since making the podium four consecutive Games from 1960 to 1972. Silver went to Peder Fredricson of Sweden. Eric Lamaze of Canada took bronze, becoming the first person since 1968 and sixth overall to win multiple medals (adding to his 2008 gold).
The medals were presented by Gerardo Werthein, IOC member, Argentina and Luiz Roberto Giugni, Executive Board Member of the FEI.",172
Equestrian at the 2016 Summer Olympics – Individual jumping,Background,"This was the 25th appearance of the event, which had first been held at the 1900 Summer Olympics and has been held at every Summer Olympics at which equestrian sports have been featured (that is, excluding 1896, 1904, and 1908). It is the oldest event on the current programme, the only one that was held in 1900.
Three of the top 11 riders (including ties for 9th place) from the 2012 Games returned: gold medalist Steve Guerdat of Switzerland, fifth-place finisher Nick Skelton of Great Britain, and ninth-place finisher Ben Maher of Great Britain. Also returning was 2008 gold medalist Eric Lamaze of Canada, who reached the first round of the final in 2012. Ludger Beerbaum of Germany, the 1992 gold medalist, was back for his seventh Games after missing 2012. The reigning World Champion was Jeroen Dubbeldam of the Netherlands.
Chinese Taipei, Morocco, Peru, and Qatar each made their debut in the event. France and the United States both competed for the 22nd time, tied for most of any nation.",228
Judo at the 2016 Summer Olympics – Men's 100 kg,Summary,"The men's 100 kg competition in judo at the 2016 Summer Olympics in Rio de Janeiro was held on 11 August at the Carioca Arena 2.
The gold and silver medals were determined by a single-elimination tournament, with the winner of the final taking gold and the loser receiving silver.  Judo events awarded two bronze medals.  Quarterfinal losers competed in a repechage match for the right to face a semifinal loser for a bronze medal (that is, the judokas defeated in quarterfinals A and B competed against each other, with the winner of that match facing the semifinal loser from the other half of the bracket).
The medals for the competition were presented by Alex Gilady, Israel, member of the International Olympic Committee and the gifts were presented by Rovnag Adullayev, Azerbaijan Judo Federation president.",181
São Tomé and Príncipe at the 2016 Summer Olympics,Summary,"São Tomé and Príncipe competed at the 2016 Summer Olympics in Rio de Janeiro, Brazil, from 5 to 21 August 2016. The country's participation at Rio de Janeiro marked its sixth consecutive appearance at the Summer Olympics. Three athletes from São Tomé and Princípe were selected for the Games. Romário Leitão and Celma Bonfim da Graça participated in athletics and Buly Triste in flatwater canoeing. Bonfim was the only female on the roster and the only member with prior Olympic experience (from Beijing 2008). Triste was the first male athlete to carry the São Tomé and Princípe flag at the opening ceremony. São Tomé and Princípe has yet to win its first Olympic medal.",161
São Tomé and Príncipe at the 2016 Summer Olympics,Background,"São Tomé and Príncipe participated in six Summer Olympics between its debut in the 1996 Summer Olympics in Atlanta, United States and the 2016 Summer Olympics in Rio de Janeiro, Brazil. The highest number of São Toméans to participate at any single Summer Games was three in the 2008 Summer Olympics in Beijing, China, later equalled in 2016. No São Toméan has ever won a medal at the Summer Olympics. São Tomé and Principe has also never participated at any Winter Olympics.
Both São Toméan participants in athletics qualified for the Games through universality slots while Buly Triste qualified via the 2016 African Sprint Qualifier in Pretoria, South Africa. Triste was chosen to be São Tomé and Princípe's flag bearer during the Parade of Nations of the opening ceremony.",174
Cycling at the 2016 Summer Olympics – Women's BMX,Summary,"The women's BMX racing competition at the 2016 Olympic Games in Rio de Janeiro took place on 17 and 19 August 2016 at the Olympic BMX Centre.
The medals were presented by Camiel Eurlings, IOC member, Netherlands and Brian Cookson, President of the UCI.",63
Athletics at the 2016 Summer Olympics – Women's heptathlon,Summary,"The women's heptathlon competition at the 2016 Summer Olympics in Rio de Janeiro, Brazil, was won by Nafissatou Thiam of Belgium. The event was held at the Olympic Stadium on 12–13 August.",50
Gymnastics at the 2016 Summer Olympics – Women's artistic team all-around,Summary,"The women's artistic team all-around competition at the 2016 Summer Olympics was held on 9 August 2016 at the HSBC Arena.
The United States finished first in the qualification and then won the event final by over eight points. It was Team USA's second consecutive Olympic team gold medal. The 2016 team, known as the Final Five, was led by Simone Biles, who performed all four rotations in the final. Russia won their second consecutive Olympic team silver.",97
Gymnastics at the 2016 Summer Olympics – Women's artistic team all-around,Competition format,"The top 8 teams in qualifications, based on combined scores of each apparatus, advanced to the final.
In the final, each team selected three gymnasts to compete on each apparatus. All scores on each apparatus were summed to give a final team score. The scores in qualification did not count in the final.",65
Athletics at the 2016 Summer Olympics – Men's decathlon,Summary,"The men's decathlon competition at the 2016 Summer Olympics in Rio de Janeiro, Brazil. The event was held at the Olympic Stadium between 17 and 18 August.
The medals were presented by Dagmawit Girmay Berhane, IOC member, Ethiopia and Bernard Amsalem, Council Member of the IAAF.",71
Athletics at the 2016 Summer Olympics – Men's decathlon,Competition format,"The decathlon consists of ten track and field events, with a points system that awards higher scores for better results in each of the ten components. The athletes all compete in one competition with no elimination rounds.",44
