title,heading,content,tokens
Tonga at the 2016 Summer Olympics,Summary,"Tonga competed at the 2016 Summer Olympics in Rio de Janeiro, Brazil, from 5 to 21 August 2016. This is the nation's ninth consecutive appearance at the Summer Olympics.
Tonga Sports Association and National Olympic Committee sent the nation's largest delegation to the Games since its official debut at the 1984 Summer Olympics in Los Angeles. A total of seven athletes, four men and three women, were selected to the Tongan team across four different sports; four of them granted universality places to compete in their respective sporting events, with the other three qualifying for the Games on merit through continental tournaments.
Breaststroke swimmer Amini Fonua was the only Tongan athlete to have represented at the previous Games, with the rest of the field making their Olympic debut in Rio de Janeiro. Tonga's first ever taekwondo fighter and oldest competitor (aged 32) at the Olympics, Pita Taufatofua, who led his delegation as the flag bearer in the opening ceremony, instantly became an internet sensation by millions of viewers, when he marched into the Maracana Stadium shirtless, smothered in coconut oil, and dressed in a traditional ta'ovala (a Tongan mat).
Tonga, however, failed to win its first Olympic medal since the 1996 Summer Olympics in Atlanta, where boxer Paea Wolfgramm bagged the silver in the men's super heavyweight division.",288
Tonga at the 2016 Summer Olympics,Archery,One Tongan archer has qualified each for the men's and women's individual recurve at the Olympics with a top two finish at the Oceania Qualification Tournament in Nuku'alofa. This is Tonga's return to the Olympic competition in the sport after a 12-year hiatus.,66
Swimming at the 2016 Summer Olympics – Women's 50 metre freestyle,Summary,"Pernille Blume defeated the field of experienced sprinters to give Denmark its first Olympic swimming title in 68 years. Leading the program's shortest race from prelims into the semifinals, she splashed her way to a gold-medal triumph in 24.07, but fell short of her attempt to overhaul Ranomi Kromowidjojo's Olympic record by a small fraction of a second. U.S. sprinter Simone Manuel, newly crowned Olympic champion of the 100 m freestyle, settled for the silver in 24.09, stopping 0.02 seconds behind Blume. Meanwhile, London 2012 runner-up Aliaksandra Herasimenia of Belarus secured the top three spot with a 24.11 for the bronze.
Great Britain's Francesca Halsall narrowly missed out of the medals by 0.02 of a second, finishing with a fourth-place time in 24.13. Unable to bounce back from their out-of-medal feat in the 100 m freestyle, sisters and pre-race favorites Cate (24.15) and Bronte Campbell (24.42) slipped to fifth and seventh, respectively, while defending champion Kromowidjojo of the Netherlands split the Australian duo to take the sixth spot in 24.19. Brazil's hometown favorite Etiene Medeiros wrapped up the top eight with a 24.69.
Notable swimmers failed to reach the top eight final, including Blume's fellow sprinter Jeanette Ottesen, London 2012 finalist Arianna Vanderpool-Wallace of the Bahamas, and Swedish tandem of three-time medalist Sarah Sjöström and Therese Alshammar, who built a historic milestone as the first ever female in the pool to compete at her sixth Olympics.",368
Cycling at the 2016 Summer Olympics – Men's road time trial,Summary,"The men's individual time trial was one of 18 cycling events of the 2016 Summer Olympics. The event started and finished on 10 August at Pontal, a small peninsula and beach area in the Recreio dos Bandeirantes neighborhood, located in the West Zone of Rio de Janeiro, Brazil. The race start and finish were part of the Barra venues cluster and one of seven temporary venues of the 2016 Summer Olympics.",88
Grenada at the 2016 Summer Olympics,Summary,"Grenada competed at the 2016 Summer Olympics in Rio de Janeiro, Brazil, from 5 to 21 August 2016. This was the nation's ninth consecutive appearance at the Summer Olympics.
Grenada Olympic Committee sent a total of seven athletes, five men and two women, to the Games, competing only in athletics and swimming. The Grenadian team featured two returning athletes from London 2012; decathlete Kurt Felix and track sprinter Kirani James, who became the nation's first ever Olympic champion, earning the gold in the men's 400 metres. As the most successful athlete of the Games, James was selected to carry the Grenadian flag for the second consecutive time in the opening ceremony.
Grenada left Rio de Janeiro with an Olympic silver medal won by James in the men's 400 metres, unable to defend his title from the previous Games.",176
Liechtenstein at the 2016 Summer Olympics,Summary,"Liechtenstein competed at the 2016 Summer Olympics in Rio de Janeiro, Brazil, from 5 to 21 August 2016. Since the nation's official debut in 1936, Liechtensteinian athletes have appeared in every edition of the Summer Olympic Games, except for two occasions. Liechtenstein did not register any athletes at the 1956 Summer Olympics in Melbourne, and eventually joined the United States-led boycott when Moscow hosted the 1980 Summer Olympics. The 2016 delegation included two swimmers, Christoph Meier and Julia Hassler, and tennis player Stephanie Vogt. Two of the athletes debuted in the 2012 Summer Olympics, with long-distance freestyle swimmer Julia Hassler leading the squad as the nation's flag bearer in the opening ceremony. Liechtenstein has yet to win a Summer Olympic medal.",165
Liechtenstein at the 2016 Summer Olympics,Background,"Liechtenstein participated in seventeen Summer Olympic Games between its debut in the 1936 Summer Olympics in Berlin, Germany, and the 2016 Summer Olympics in Rio de Janeiro, Brazil. The highest number of Liechtensteiners participating at any one Summer Games was 12 in the 1988 Summer Olympics in Seoul, South Korea. No Liechtensteiner has ever won a medal at the Summer Olympics. However, Liechtenstein has won nine medals at the Winter Olympic Games. All of the Liechtensteiner participants competed at the 2016 Summer Olympics through invitations by FINA or the ITF. Hassler was chosen to be Liechtenstein's flag bearer during the Parade of Nations of the opening ceremony while Meier bore the flag during the closing ceremony.",155
Albania at the 2016 Summer Olympics,Summary,"Albania competed at the 2016 Summer Olympics in Rio de Janeiro, Brazil, from 5 to 21 August 2016. This was the nation's eighth appearance at the Olympics after its debut in 1972. The National Olympic Committee of Albania sent a total of six athletes to the Games, three per gender, who competed in three sports (athletics, swimming, and weightlifting).
Notable athletes in the Albanian roster featured weightlifter and London 2012 Olympian Briken Calja, swimmer Sidni Hoxha, who competed at his third Olympics in the sprint freestyle, and middle-distance runner Luiza Gega, who was selected to carry the nation's flag in the opening ceremony. Albania has yet to win its first Olympic medal.",155
Liberia at the 2016 Summer Olympics,Summary,"Liberia competed at the 2016 Summer Olympics in Rio de Janeiro, Brazil, from 5 to 21 August 2016. This was the nation's twelfth appearance at the Olympics since its debut in 1956, except for four occasions. Liberia failed to register any athletes at both the 1968 and 1992 Summer Olympics, joined the rest of the African nations to boycott the 1976 Summer Olympics in Montreal, and joined the United States-led boycott of the 1980 Summer Olympics, withdrawing after the opening ceremony.
The Liberian team featured two track and field athletes at the Games: sprinters Mariam Kromah and Emmanuel Matadi, who was selected to carry the nation's flag in the opening ceremony.  Liberia, however, has yet to win its first Olympic medal, as neither of the athletes passed the first round of their respective sporting events.",169
Sailing at the 2016 Summer Olympics – Finn,Summary,"The men's Finn competition at the 2016 Summer Olympics in Rio de Janeiro took place between 9–16 August at Marina da Glória. Eleven races (the last one a medal race) were held. British sailor Giles Scott was declared gold medallist before the competition ended, having an unassailable lead before the medal race.",71
Mozambique at the 2016 Summer Olympics,Summary,"Mozambique competed at the 2016 Summer Olympics in Rio de Janeiro, Brazil, from 5 to 21 August 2016. This was the nation's tenth consecutive appearance at the Summer Olympics.
The Mozambique National Olympic Committee (Portuguese: Comité Olímpico Nacional de Moçambique) sent a team of six athletes, five men and one woman, to compete in four different sports at the Games. Among the sports represented by the athletes, Mozambique marked its Olympic debut in flatwater canoeing.
The majority of the Mozambican roster made their Olympic debut in Rio de Janeiro, except for hurdler Kurt Couto, who attended his fourth straight Games as the most experienced competitor. Other notable athletes included Dutch-born butterfly swimmer and 2014 Youth Olympian Jannah Sonnenschein, the lone female of the team, and the canoeing tandem of Mussa Chamaune and Joaquim Lobo, who acted as the nation's flag bearer in the opening ceremony.
Mozambique, however, failed to win a single Olympic medal since the 2000 Summer Olympics in Sydney, where middle-distance runner Maria Mutola became the nation's first ever champion in the women's 800 metres.",257
Republic of the Congo at the 2016 Summer Olympics,Summary,"Congo, officially Republic of the Congo, competed at the 2016 Summer Olympics in Rio de Janeiro, from August 5 to 21, 2016. This was the nation's twelfth appearance at the Summer Olympics, since its debut in 1964. Congolese athletes did not attend the 1968 Summer Olympics in Mexico City, and the 1976 Summer Olympics in Montreal because of the African boycott.
Congolese Olympics & Sports Committee (French: Comité National Olympique et Sportif Congolais) sent the nation's largest delegation to the Games in a non-boycotting edition. A total of ten athletes, seven men and three women, were selected to the team across five different sports, with two of them returning from London 2012. Table tennis player Suraju Saka, who competed at his third Games, was the oldest (aged 40) and most experienced member of the squad. Meanwhile, shot putter and reigning All-African Games champion Franck Elemba served as the nation's flag bearer in the opening ceremony.
Congo narrowly missed out on its first ever Olympic medal in Rio de Janeiro, as Franck Elemba placed fourth in the men's shot put.",243
Republic of the Congo at the 2016 Summer Olympics,Athletics (track and field),"Congolese athletes have so far achieved qualifying standards in the following athletics events (up to a maximum of 3 athletes in each event):

Track & road events

Field events",43
Swimming at the 2016 Summer Olympics – Men's 100 metre freestyle,Summary,"At 18 years of age, Kyle Chalmers defeated the experienced field of sprinters to become Australia's first Olympic champion in this event since Michael Wenden topped the podium in 1968. Rallying from seventh at the halfway turn, he overhauled the field for the gold medal and a junior world record in 47.58. Swimming out of lane seven, Pieter Timmers posted a 47.80 to take home the silver for the Belgians, along with a national record. Meanwhile, U.S. sprinter and defending champion Nathan Adrian barely advanced out of the prelims earlier, but bounced back to earn a bronze in the final with a 47.85.
Leading the race early on the initial length, Canada's Santo Condorelli narrowly slipped out of the podium to fourth in 47.88, just a 0.03-second deficit behind Adrian. British teenager Duncan Scott finished fifth in 48.01 to match his own national record that he set in the heats. American youngster Caeleb Dressel picked up a sixth spot in 48.02, while Australia's pre-race favorite Cameron McEvoy dropped back to seventh in 48.12. Amid the delight of the home crowd, Brazil's Marcelo Chierighini rounded out the field with an eighth-place time in 48.42.
Notable swimmers missed the final roster, including China's Ning Zetao, the defending World champion, and Russia's Vladimir Morozov, who was allowed to compete in Rio, after filing a successful appeal against his possible doping report ban.",321
Rowing at the 2016 Summer Olympics – Women's quadruple sculls,Summary,"The women's quadruple sculls competition at the 2016 Summer Olympics in Rio de Janeiro was held on 6–11 August at the Lagoon Rodrigo de Freitas.
The medals for the competition were presented by Irena Szewińska, Poland, member of the International Olympic Committee, and the gifts were presented by Lenka Wech, Germany, Member of the Executive Committee of the International Rowing Federation.",92
Nigeria at the 2016 Summer Olympics,Summary,"Nigeria competed at the 2016 Summer Olympics in Rio de Janeiro, from August 5 to 21, 2016. Since the nation made its debut in 1952, Nigerian athletes had appeared in every edition of the Summer Olympic Games, with the exception of the 1976 Summer Olympics in Montreal because of the African boycott.
Nigeria Olympic Committee fielded a squad of 77 athletes, 51 men and 26 women, to compete in ten sports at the Games. It was the nation's largest delegation sent to the Olympics since 2000, increasing by a third of its full roster size at London 2012. Among the sports represented by the nation's athletes, Nigeria marked its Olympic debut in rowing, as well as its return to swimming and men's football after an eight-year hiatus. Apart from the men's football squad, Nigeria also returned to the Olympic scene in men's basketball for the second consecutive time.
Topping the list of most experienced athletes on the Nigerian roster were table tennis players Segun Toriola, who set a record as Africa's first ever athlete to feature in seven Olympics, and Olufunke Oshonaike, who became the first female from her country to compete at her sixth consecutive Games. Other notable Nigerian competitors also included sprinter and 2008 bronze medalist Blessing Okagbare, British-born slalom kayaker Jonathan Akinyemi, basketball players Chamberlain Oguchi and Alade Aminu, and weightlifting veteran Mariam Usman (women's +75 kg). Football midfielder John Obi Mikel was named the captain of the Nigerian squad, while Oshonaike acted as both his assistant and the nation's flag bearer at the opening ceremony.
Nigeria left Rio de Janeiro with only a bronze medal won by the men's football squad (captained by Mikel), scoring a 3–2 triumph over the Hondurans.",375
Jordan at the 2016 Summer Olympics,Summary,"Jordan competed at the 2016 Summer Olympics in Rio de Janeiro, Brazil, from 5 to 21 August 2016. This was the nation's tenth consecutive appearance at the Summer Olympics.
The Jordan Olympic Committee selected a team of eight athletes, seven men and one woman, to compete in six sports at the Games. The nation's roster in Rio de Janeiro was also a replication to those sent to Sydney 2000 and Athens 2004, respectively, but had the highest percentage of men in its Olympic history since 1984. Among the sports represented by the athletes, Jordan made its Olympic debut in triathlon.
The Jordanian team featured two returning athletes from London 2012: Methkal Abu Drais in men's marathon, and Talita Baqlah, who became the first swimmer to attend two Olympic Games, along with her younger brother Khader. Meanwhile, super heavyweight boxer Hussein Ishaish was chosen by the committee to carry the Jordanian flag in the opening ceremony.
Jordan left Rio de Janeiro with its first ever Olympic gold medal, and the first medal of any color since the 1992 Olympics in Barcelona. It was won by taekwondo fighter Ahmad Abu-Ghaush in the men's featherweight category.",245
Rowing at the 2016 Summer Olympics – Men's coxless four,Summary,"The men's coxless four competition at the 2016 Summer Olympics in Rio de Janeiro was held from 8 to 12 August at the Lagoon Rodrigo de Freitas.
The medals for the competition were presented by Sir Craig Reedie, Great Britain, member of the International Olympic Committee, and the gifts were presented by Mike Tanner, Hong Kong, Member of the Executive Committee of the International Rowing Federation.",85
Athletics at the 2016 Summer Olympics – Men's marathon,Summary,"The men's marathon at the 2016 Olympic Games in Rio de Janeiro took place on the Sambódromo on 21 August, the final day of the Games. One hundred fifty-five athletes from 79 nations competed. The event was won by Eliud Kipchoge of Kenya, the nation's second victory in the event in three Games. Feyisa Lilesa of Ethiopia took silver, while Galen Rupp of the United States took bronze. The defending champion going into the marathon was Ugandan Stephen Kiprotich.",113
Athletics at the 2016 Summer Olympics – Men's marathon,Background,"This was the 28th appearance of the event, which is one of 12 athletics events to have been held at every Summer Olympics. Seven of the top ten runners from the 2012 marathon returned: gold medalist (and 2013 world champion) Stephen Kiprotich of Uganda, fourth-place finisher (and 2004 silver medalist) Meb Keflezighi of the United States, fifth-place finisher Marilson Dos Santos of Brazil, seventh-place finisher Cuthbert Nyasango of Zimbabwe, eighth-place finisher Paulo Roberto Paula of Brazil, ninth-place finisher Henryk Szost of Poland, and tenth-place finisher Ruggero Pertile of Italy. Ghirmay Ghebreslassie of Eritrea was the reigning world champion. Eliud Kipchoge of Kenya was the favorite, with six major wins in the past four years after moving to the road from the track.
Azerbaijan, Georgia, Panama, the Refugee Olympic Team, and Uzbekistan each made their first appearance in Olympic men's marathons. South Sudan made its first formal appearance, though it had had one runner appear as an Independent Olympic Athlete in 2012. The United States made its 27th appearance, most of any nation, having missed only the boycotted 1980 Games.",275
Eritrea at the 2016 Summer Olympics,Summary,"Eritrea competed at the 2016 Summer Olympics in Rio de Janeiro, Brazil, from 5 to 21 August 2016. It was the nation's fifth consecutive appearance at the Summer Olympics.
The Eritrean National Olympic Committee selected a total of 12 athletes, eleven men and one woman, to compete in athletics and cycling sports at the Games, matching its team size with London 2012. Competitors Nebiat Habtemariam and Athens 2004 bronze medalist Zersenay Tadese both returned for their fourth Olympic appearance.
Eritrea left Rio de Janeiro without a single Olympic medal for the third consecutive time. Ghebreslassie missed out on the nation's second medal at the Olympic Games, finishing fourth in the men's marathon.",154
Eritrea at the 2016 Summer Olympics,Background,"Eritrea participated in five Summer Olympics between its debut in the 2000 Summer Olympics in Sydney, Australia, and the 2016 Summer Olympics in Rio de Janeiro, Brazil. The highest number of Eritreans participating at any single Summer Games was seven at the previous London 2012 and Rio 2016. The flag bearer for the parade of nations was an unnamed volunteer while an alternative athlete named Tsegay Tuemay bore the flag for the closing ceremony. Only one Eritrean athlete has ever won a medal at the Olympics, long-distance runner Zersenay Tadese, who won a bronze medal in the 2004 men's 10,000 metres event.",133
Hong Kong at the 2016 Summer Olympics,Summary,"Hong Kong competed at the 2016 Summer Olympics in Rio de Janeiro, Brazil, from 5 to 21 August 2016. This was the territory's sixteenth appearance at the Summer Olympics, since its debut as a British colony in 1952.
The Sports Federation and Olympic Committee of Hong Kong, China sent a team of 37 athletes, 13 men and 24 women, to compete in nine sports at the Games. The nation's full roster in Rio de Janeiro was smaller by five athletes than in London, and also, featured more female athletes than males for only the second time in its Olympic history.
Eleven athletes from Hong Kong previously competed at London 2012, including bronze medalist Lee Wai Sze in track cycling, badminton player Yip Pui Yin in the women's singles, mountain biker Chan Chun Hing, and 37-year-old table tennis player Tie Ya Na, who attended her fourth Olympics as the oldest and most experienced member. Other notable athletes on the Hong Kong roster also featured Youth Olympians Doo Hoi Kem (table tennis) and 18-year-old Siobhán Haughey (swimming), Asia's top-ranked épée fencer Vivian Kong, and backstroke swimmer and three-time Olympian Stephanie Au, who was selected by the committee to carry the Hong Kong flag at the opening ceremony.
Unlike the previous Games, Hong Kong failed to win a single medal in Rio de Janeiro. The special administrative region's best medal hope, Lee Wai Sze missed out on a place in the finals of her respective track cycling events, following her involvement in the controversial clash in the women's keirin, and her quarterfinal defeat to Germany's eventual champion Kristina Vogel in the women's sprint. Meanwhile, windsurfer Michael Cheng wrapped up his Olympic campaign with one of Hong Kong's most unexpected outcomes at the Games, finishing eighth overall.",390
Maldives at the 2016 Summer Olympics,Summary,"The Maldives competed at the 2016 Summer Olympics in Rio de Janeiro, Brazil, from 5 to 21 August 2016. This was the nation's eighth consecutive appearance at the Summer Olympics. The delegation included two track and field athletes: Hassan Saaid and Afa Ismail, as well as swimmers Ibrahim Nishwan and Aminath Shajan. Both Shajan and Ismail were returning competitors from the 2012 London Olympics, with the former leading the Maldivian squad as the flag bearer in the opening ceremony. The Maldives, however, has yet to win its first ever Olympic medal.",123
Maldives at the 2016 Summer Olympics,Background,"The Maldives participated in eight Summer Olympics between its debut in the 1988 Summer Olympics in Seoul, South Korea, and the 2016 Summer Olympics in Rio de Janeiro, Brazil. The highest number of Maldivians participating at any single Summer Games was seven at the 1988 Games in Seoul, South Korea and the 1992 Games in Barcelona, Spain. No Maldivian has ever won a medal at the Olympics. All of Maldivian participants competed at the Games through universality slots from the International Association of Athletics Federations and FINA. Shajan was chosen to be The Maldives's flag bearer during the parade of nations of the opening ceremony while Ismail bore the flag during the closing ceremony.",142
Botswana at the 2016 Summer Olympics,Summary,"Botswana competed at the 2016 Summer Olympics in Rio de Janeiro, from 5 to 21 August 2016. This was the nation's tenth consecutive appearance at the Summer Olympics.
Botswana National Olympic Committee sent the nation's largest delegation to the Games. A total of 12 athletes, 9 men and 3 women, were selected to compete only in athletics, judo, and swimming. The nation's team was relatively larger by two-thirds of its size from London 2012, where Botswana registered only four athletes.
Among the Botswana athletes on the team were freestyle swimmer Naomi Ruele, and middle-distance runner Nijel Amos, who built a historic milestone as the nation's first ever Olympic medalist, earning a silver in the men's 800 metres. The most successful athlete from London 2012, Amos was selected to lead the team as Botswana's flag bearer into the opening ceremony.
Botswana, however, left Rio de Janeiro without a single medal, failing to reproduce it from the previous Games. The men's 4 × 400 m relay squad, led by top sprinter Isaac Makwala, came close to adding another medal for Botswana, but finished fifth in the final.",248
Botswana at the 2016 Summer Olympics,Athletics,"Botswana athletes have so far achieved qualifying standards in the following athletics events (up to a maximum of 3 athletes in each event):

Track & road events
Men

Women",41
Cycling at the 2016 Summer Olympics – Women's omnium,Summary,"The women's cycling omnium at the 2016 Olympic Games in Rio de Janeiro took place at the Rio Olympic Velodrome on 15 and 16 August.
The medals were presented by Adam Pengilly, IOC member, Great Britain and Harald Hansen, Member of the UCI Management Committee.",62
Cycling at the 2016 Summer Olympics – Women's omnium,Competition format,"The omnium competition consists of six events. During the first five events, riders receive points depending on their place, while during the final points race they can obtain points by winning sprints and taking laps during the event.

Scratch race: a 10 km (6.2 mi) scratch race, with all riders competing at once and first across the line winning.
Individual pursuit: a 3 km (1.9 mi) individual pursuit, with placing based on time.
Elimination race: a ""miss-and-out"" elimination race, with the last rider in every sprint (each two laps) eliminated.
Time trial: a 500 m (1,640.4 ft) time trial, with two riders (starting opposite the track) riding at once.
Flying lap: an individual time trial over 250 m (820.2 ft) with a ""flying start"".
Points race: a 20 km (12.4 mi) points race, with scoring for intermediate sprints as well as for lapping the pack.",216
