title,heading,content,tokens
Golf at the 2016 Summer Olympics – Qualification,Summary,"Qualification for Golf at the 2016 Summer Olympics in Rio de Janeiro, Brazil was determined not by any form of qualifying tournament, but by the rankings maintained by the International Golf Federation.
Qualification was based on world ranking (Official World Golf Ranking for men, Women's World Golf Rankings for women) as of 11 July 2016, with a total of 60 players qualifying in each of the men's and women's events. The top 15 players of each gender qualified, with a limit of four golfers per country that could qualify this way. The remaining spots went to the highest-ranked players from countries that did not already have two golfers qualified, with a limit of two per country. The IGF guaranteed that at least one golfer would qualify from the host nation and also at least one from each continent (Africa, the Americas, Asia, Europe, and Oceania). The IGF posted weekly lists of qualifiers based on current rankings for men and women.",197
Weightlifting at the 2016 Summer Olympics – Qualification,Summary,"This article details the qualifying phase for weightlifting at the 2016 Summer Olympics.  The competition at these Games includes 260 athletes. Each competing nation is allowed to enter a maximum of 10 competitors, 6 men and 4 women. 2014 and 2015 World Weightlifting Championships are the main qualifying events for the 2016 Olympic games. NOCs achieve qualification places according to their position in the joint team classification by points adding those scored in the 2014 and 2015 World Championships. One continental qualification event is held for each continent in 2016. Only NOCs which have not gained quota places in the Main Qualification Events may obtain quota places.
On November 19, 2015, the International Weightlifting Federation banned Bulgaria from competing at the Rio Olympics due to doping, and took one Olympic entry place from Romania and Uzbekistan because of ""multiple positive cases"" of doping.
On 22 June 2016, the International Weightlifting Federation announced that a number of countries would lose quota places in weightlifting at the Games because of doping violations. IWF then went on to state that if the testing of 'B' samples confirmed any country had three or more violations in the 2008 and 2012 Olympic retesting programme, that country would be suspended from international weightlifting for one year, and would thereby be excluded from the Games in Rio, alongside the already suspended Bulgaria.
IWF clarified that after retesting of 'A' samples from 2008 and 2012 that the three countries therefore scheduled for suspension were Kazakhstan, Russia and Belarus. Russia is appealing this decision also to the Court of Arbitration for Sport on 6 July 2016. In addition, quota places have been removed from Azerbaijan (2), Belarus (1), Kazakhstan (1), Moldova (2), North Korea (2), Russia (2), Romania (1) and Uzbekistan (1).",364
Handball at the 2016 Summer Olympics – Men's qualification,Summary,"The qualification for the 2016 Men's Olympic Handball Tournament was held from January 2015 to April 2016. Twelve teams qualified, the hosts, the world champion, four continental event winners and six teams from the World Olympic qualification tournaments respectively.",50
Football at the 2016 Summer Olympics,Summary,"The association football tournament at the 2016 Summer Olympics was held from 3 to 20 August in Brazil.
In addition to the Olympic host city of Rio de Janeiro, matches were played in Belo Horizonte, Brasília, Salvador, São Paulo, and Manaus. All six cities hosted matches during the 2014 World Cup, with the Estádio Olímpico João Havelange in Rio de Janeiro the only Olympic venue not to have been a World Cup venue.
Associations affiliated with FIFA might send teams to participate in the tournament. Men's teams were restricted to under-23 players (born on or after 1 January 1993) with a maximum of three overage players allowed, while there were no age restrictions on women's teams. The Games made use of about 400 footballs.",168
Equestrian events at the 2016 Summer Olympics,Summary,The equestrian events at the 2016 Summer Olympics in Rio de Janeiro were held between 6 and 19 August at National Equestrian Center in Deodoro. Medals were awarded in three disciplines for both individual and team competitions.,49
Swimming at the 2016 Summer Olympics – Men's 400 metre individual medley,Summary,"London 2012 bronze medalist Kosuke Hagino held off a late challenge from the U.S. swimmer Chase Kalisz down the final stretch to touch the wall first in a new Asian record of 4:06.05. Kalisz managed to secure his first Olympic career medal with a personal best of 4:06.75 for a silver. Meanwhile, Hagino's fellow countryman and 2015 world champion Daiya Seto captured the bronze in 4:09.71, to give Japan two swimmers on the same Olympic podium for the first time in 60 years.
Great Britain's Max Litchfield finished off the podium with a fourth-place time in 4:11.62, edging out the American Jay Litherland by six-hundredths of a second (4:11.68). Australian duo Thomas Fraser-Holmes (4:11.90) and Travis Mahoney (4:15.48), as well as Spain's Joan Lluís Pons (4:16.58) closed out the field.
Germany's Jacob Heidtmann, who established a new national record of 4:11.85 to finish among the top eight for the final, was disqualified for using two dolphin kicks in the breaststroke leg during the prelims.
The medals for the competition were presented by Henri, Grand Duke of Luxembourg, IOC member, and the gifts were presented by Dr. Julio Maglione, President of the FINA.",304
Swimming at the 2016 Summer Olympics – Women's 4 × 100 metre medley relay,Summary,"The women's 4 × 100 metre medley relay event at the 2016 Summer Olympics took place on 12–13 August at the Olympic Aquatics Stadium in Rio de Janeiro. By winning gold, the U.S. women brought home America's 1000th gold medal in the nation's Summer Olympics history.",64
Swimming at the 2016 Summer Olympics – Men's 200 metre butterfly,Summary,"As the most decorated Olympian of all-time, Michael Phelps got the opportunity to avenge the distance butterfly title that he lost in London four years earlier, when South Africa's Chad le Clos beat him to the wall. Moving to the front at the halfway turn, Phelps held off the Japanese challenger Masato Sakai by a 0.04-second margin to claim his twentieth Olympic gold medal and twenty-fifth overall in 1:53.36. Coming from sixth at the 150-metre turn, Sakai made a late surge on the final length to nearly upset Phelps towards a close finish, but he ended up taking the silver in 1:53.40. Meanwhile, Hungary's top seed and 2014 Youth Olympic champion Tamás Kenderesi powered home with a bronze in 1:53.62.
Le Clos did not produce another striking effort to halt the most decorated Olympian from snatching the title, as he was shut out of the medals to fourth in 1:54.06. Sakai's teammate Daiya Seto finished fifth in 1:54.82, with Denmark's Viktor Bromer following him to pick up the sixth spot in 1:55.64. Hungarian swimmer, 2008 Olympic silver medalist, and reigning world champion László Cseh commanded a brief lead on the initial length, but faded shortly to seventh place in 1:56.24. Belgium's Louis Croenen rounded out the field with an eighth-place time in 1:57.04.",312
Swimming at the 2016 Summer Olympics – Women's 200 metre breaststroke,Summary,"Japan's Rie Kaneto pulled away from a tightly-packed field over a wide margin to become the country's third gold medalist in the event's history, since Hideko Maehata topped the podium in 1936, and Kyoko Iwasaki in 1992. She swam through the final lap to a decisive gold-medal triumph in 2:20.30, but fell short of her attempt to overhaul a sub-2:20 range at the Games. Russia's Yuliya Yefimova launched a late charge on the home stretch to get her second silver of the meet in 2:21.97. Meanwhile, China's Shi Jinglin rebounded from an out-of-medal feat in the 100 m breaststroke three days earlier to earn the bronze with a 2:22.28, beating Great Britain's Chloe Tutton (2:22.34) by just six hundredths of a second.
Australia's Taylor McKeown seized a substantial lead through the initial half of the race, but slipped shortly off the podium to fifth in 2:22.43. Tutton's teammate Molly Renshaw, who scratched the existing British record earlier in the semifinals, picked up a sixth spot in 2:22.72. Outside the 2:22 club, Canada's Kierra Smith (2:23.19) and Denmark's world-record holder Rikke Møller Pedersen (2:23.74) rounded out the field.
Tandem Molly Hannis and Lilly King, the newly-crowned Olympic champion of the 100 m breaststroke, had put their medal hunt to an end in this event, as neither of them advanced to the final. Other notable swimmers missed the top eight roster, featuring Japan's Kanako Watanabe, the 2015 world champion, and Turkey's Viktoriya Zeynep Güneş, the fastest pre-race seed headed to the Games.
The medals for the competition were presented by Yumilka Ruiz, IOC member from Colombia, and the gifts were presented by Kazuo Sano, executive member of the FINA.",438
Swimming at the 2016 Summer Olympics – Men's 200 metre individual medley,Summary,"As the most decorated Olympian of all-time, Michael Phelps continued to etch his name into the history records with a first Olympic four-peat in the same individual swimming event. Hanging with some of his career rivals at the final turn, Phelps established a body-length lead over the rest of the field on the freestyle leg to claim his 22nd gold medal and 26th overall in 1:54.66. Trailing almost two seconds behind Phelps, Japan's Kosuke Hagino produced a late surge to snatch the silver with a 1:56.61. Meanwhile, China's Wang Shun took home the bronze in 1:57.05, joining Hagino as the first Asian men to stand on the podium in this event.
Hagino's teammate Hiromasa Fujimori missed out of the medals with a fourth-place time in 1:57.21. Phelps' longtime rival and twelve-time medalist Ryan Lochte seized a brief lead into the halfway point with a signature backstroke swim, but faded down the home stretch to fifth, and missed out on his fourth straight medal in this event with a 1:57.47, a hundredth of a second ahead of Germany's Philip Heintz (1:57.48). Backed by the raucous home crowd, Brazilian medal favorite Thiago Pereira, who got off to an early lead with a powerful butterfly effort, slipped to seventh with a 1:58.02. Great Britain's Daniel Wallace posted an eighth-place finish of 1:58.54 to round out the field.",326
Swimming at the 2016 Summer Olympics – Men's 1500 metre freestyle,Summary,"Italian swimmer and 2015 world champion Gregorio Paltrinieri outlasted the field on the closing stages to become his country's first ever Olympic champion in the program's longest pool race. Strengthening his lead from start to finish, Paltrinieri headed into the 1,400-metre turn under a world-record pace, but fell off towards the end for the gold medal in 14:34.57. U.S. distance ace Connor Jaeger overhauled the sub-14:40 barrier with an American record of 14:39.48 for the silver. Meanwhile, Paltrinieri's countryman Gabriele Detti gave the Italians a further reason to celebrate, as he powered home with a bronze in 14:40.86, overtaking the American challenger Jordan Wilimovsky (14:45.03) by almost five seconds.
Australia's Mack Horton, who claimed the 400 m freestyle title on night one, picked up the fifth spot with a 14:49.54 to hold off a sprint race from Canada's Ryan Cochrane (14:49.61), two-time medalist in this event, by seven hundredths of a second.  France's Damien Joly finished seventh in 14:52.73, with Norway's Henrik Christiansen (15:02.66) rounding out the top eight field.
China's world-record holder Sun Yang missed a chance to defend his Olympic title in this event, after posting the sixteenth fastest time (15:01.97) in the preliminary competition. Meanwhile, Tunisian swimmer and Beijing 2008 champion Oussama Mellouli failed to advance to the top eight final with a twenty-first-place finish in his fifth Olympic appearance.",359
Swimming at the 2016 Summer Olympics – Men's 200 metre backstroke,Summary,"The American tradition of excellence continued in the distance backstroke, as Ryan Murphy made a historic milestone to claim the country's sixth straight title, and strike a backstroke double for the first time since Aaron Peirsol did so in 2004. He held off a stiff competition from Australia's reigning world champion Mitch Larkin down the home stretch to earn his second individual gold at the Games with a time of 1:53.62. Leading the race early on the initial length, Larkin pulled closer to Murphy about the midway through the final lap, but could not catch him near the wall to finish with a silver-medal time in 1:53.96. Meanwhile, Russia's Evgeny Rylov finished with the bronze in 1:53.97, a hundredth of a second behind Larkin.
Trailing the top three by over a second, China's Xu Jiayu, runner-up to Murphy in the 100 m backstroke on night three, took the fourth spot in 1:55.16, while his teenage teammate Li Guangyuan posted a sixth-place time in 1:55.89. U.S. swimmer Jacob Pebley, who had upset the defending champion Tyler Clary at the Olympic trials one month earlier, split the Chinese duo to finish fifth with a 1:55.52. Germany's Christian Diener (1:56.27), along with double London 2012 medalist Ryosuke Irie of Japan (1:56.36), rounded out the field.
The medals for the competition were presented by Yumilka Ruiz, Cuba, IOC member, and the gifts were presented by Dmitris Diathestopoulos, Member of the FINA Bureau.",352
Swimming at the 2016 Summer Olympics – Women's 200 metre backstroke,Summary,"U.S. swimmer Maya DiRado saved her best race for last before retiring from the sport, as she upset Hungary's Katinka Hosszú on the home stretch to claim the distance backstroke title. Coming from behind at the 150-metre turn, DiRado produced a late surge to touch out the Hungarian favorite by six hundredths of a second for the gold medal in 2:05.99. Hosszú commanded a solid lead through the first half of the race, but she was unable to hold off DiRado about the midway of the final lap, leaving with a silver in 2:06.05. Meanwhile, Canada's Hilary Caldwell swam her way into the bronze-medal position with a 2:07.54.
Russia's Daria Ustinova, who was allowed to compete in Rio after successfully appealing from her doping ban, obtained the fourth spot in 2:07.89, edging out Australia's Belinda Hocking (2:08.02) to fifth by 0.13 of a second. Zimbabwe's Kirsty Coventry, a five-time Olympian and double gold medalist in this event, capped off her illustrious Olympic career with a sixth-place finish in 2:08.80. Chinese teenager Liu Yaxin (2:09.03) and Iceland's Eygló Ósk Gústafsdóttir (2:09.44) rounded out the top eight.
World-record holder Missy Franklin missed the opportunity to defend her Olympic title in the final, after placing fourteenth in the semifinals (2:09.74). Other notable swimmers failed to reach the top eight roster, including Hocking's teammate and reigning world champion Emily Seebohm, London 2012 silver medalist Anastasia Fesikova of Russia, and Ukraine's Daryna Zevina, runner-up at the European Championships two months earlier.",403
Swimming at the 2016 Summer Olympics – Men's 4 × 100 metre freestyle relay,Summary,"Four years after losing the Olympic gold to the Frenchmen in this event, the U.S. men's team was able to get back on top of the podium at these Games. Holding a tight race against the field on the lead-off leg by Caeleb Dressel (48.10), Michael Phelps threw down a 47.12 split on the second leg to move the Americans to the front, until he handed the youngster Ryan Held (47.73) and veteran Nathan Adrian their relay duties at the remaining exchanges of the race. Adrian delivered a fastest split in the field with an anchor of 46.97 to race against the Frenchmen towards a gold-medal finish in 3:09.92. Phelps had officially come out of retirement two years earlier to extend his career resume with a nineteenth gold medal and twenty-third overall at his fifth straight Olympics.
France's Mehdy Metella (48.08), Fabien Gilot (48.20), and Florent Manaudou (47.14) handed Jérémy Stravius the anchor duties to chase down the Americans to the front, but Stravius' split of 47.11 was just good enough to settle them only for the silver in 3:10.53. Meanwhile, the Australian combination of James Roberts (48.88), Kyle Chalmers (47.38), James Magnussen (48.11), and Cameron McEvoy (47.00) snatched the bronze in 3:11.37 to hold off the Russian quartet of Andrey Grechin (48.68), Danila Izotov (48.00), Vladimir Morozov (47.31), and Alexander Sukhorukov (47.65) by nearly three tenths of a second, a fourth-place time in 3:11.64.
Outside the podium, Brazil's Marcelo Chierighini (48.12), Nicolas Oliveira (48.26), Gabriel Santos (48.72), and João de Lucca (48.11) enjoyed racing in front of the home crowd to pick up the fifth spot with a 3:13.21. The Belgian foursome of Glenn Surgeloose (48.73), Jasper Aerents (48.47), Emmanuel Vanluchene (48.82), and Pieter Timmers (47.55) struggled to mount a challenge against the top-ranked teams throughout the race, but they managed to finish sixth with a national record of 3:13.57. Canada (3:14.35) and Japan (3:14.48) rounded out the championship field.
The medals for the competition were presented by Ivan Dibos, Peru, IOC member, and the gifts were presented by Mr. Errol Clarke, Bureau Member of the FINA.",579
Swimming at the 2016 Summer Olympics – Women's 200 metre butterfly,Summary,"Spain's Mireia Belmonte stormed home on the final lap to upgrade her silver from London 2012 with an Olympic title in this event, writing a historic milestone to become the country's first female swimming champion. Closing the gap between herself and Madeline Groves at the 150-metre turn, she pipped the Australian challenger with a half-stroke swim on the final stretch to a striking gold-medal triumph in 2:04.85. Groves commanded a solid lead through the first half of the race, but could not catch the Spaniard near the wall, stopping just 0.03 seconds behind with a 2:04.88 for the silver. Meanwhile, Japan's Natsumi Hoshi delivered a powerful back-half strategy to hold on the two leaders and repeat her bronze-medal feat from London 2012 in 2:05.20.
Swimming in lane eight, Cammile Adams of the United States missed out on the podium by seven tenths of a second, as she moved up from the outside to fourth with a lifetime best of 2:05.90. Separated from each other by a 0.03-second gap, Chinese duo Zhou Yilin (2:07.37) and Zhang Yufei (2:07.40) picked up the fifth and sixth spots respectively. Adams' teammate Hali Flickinger (2:07.71) and Australian youngster Brianna Throssell (2:07.87) closed out the field.
Notable swimmers missed the final roster, including British duo Hannah Miley and Aimee Willmott, Germany's Franziska Hentke, the reigning European champion, and Hungary's Katinka Hosszú, who later scratched the afternoon prelims to prepare herself instead for a historic medley double that happened in the evening session of the same day.",385
Badminton at the 2016 Summer Olympics – Men's singles,Summary,"The badminton men's singles tournament at the 2016 Summer Olympics took place from 11 to 20 August at Riocentro - Pavilion 4. The seeding was decided on 21 July 2016.
The event was won by the reigning world champion, China's Chen Long who defeated Lee Chong Wei of Malaysia who was also runner up to Chen at the 2015 World Championships. This was Lee's third consecutive Olympic silver medal. In the bronze-medal match Denmark's Viktor Axelsen defeated Lin Dan of China.",105
Athletics at the 2016 Summer Olympics – Qualification,Russian disqualification,"Because of the suspension of the Russian Athletics Federation by the IAAF, due to widespread doping violations, Russia currently will not qualify as a team for these Olympics or other international competitions, and unless this suspension is lifted in time, Russia will be unable to send an athletics delegation to these Games. While Russia will continue to seek further appeals, the IAAF confirmed its decision on 18 June 2016 after a report by a five-member task force which reported that Russia had failed to fully address its ""deep-seeded [sic] culture"" of doping. The IAAF did provide for the possibility of accepting individual Russian athletes who have been sufficiently tested outside of the Russian system. One athlete suggested was Yuliya Stepanova for her efforts to expose the scandal.

The systematic doping that has been ongoing in Russia, it's difficult to pick the clean athletes. As you know, one or two or 100 negative tests does not mean an athlete is clean. History has not shown that is the case.
The IAAF then stated on 24 June, that athletes from Russia seeking ""exceptional eligibility for International Competition under Competition Rule 22.1A"" will be considered and have the permission to compete, ""not for Russia but as a neutral athlete"", following guidelines. These athletes have to clearly and convincingly show that they are not co involved in the Russian system (outside the country and subject to other systems). On 1 July 2016, Yuliya Stepanova became the first neutral athlete to be qualified under these rules. Darya Klishina, who lives in the United States, has also been given permission. They will compete as Independent Olympic Athletes. The Court of Arbitration for Sport confirms that verdict and rejects the appeal of 68 Russian athletes, on 21 July 2016. Whistleblower Stepanova was eventually barred from competing by the IOC, and she was called a traitor and received death threats back at home in Russia.",390
